{
  "notes": [
    "Settled policy: profile order, review floors and the single escalation; registry/pools.json maps each task kind, profile and phase to its ordered model pool.",
    "Review floor: Deep for Research, Validation and Deep-labelled issues; Standard otherwise.",
    "No phase overrides; one escalation to Deep after an unsuccessful repair.",
    "review_routing.light_review defines the low-risk review; a batch turns it on with context_controls.low_risk_review (off by default). The review may then use the lighter profile only if every deterministic check passed on the first validation (no repair or escalation), delivery checks passed, the issue has an allowed profile and task-kind label, no opt-out or gate label, is not blocked by a batch human-gate issue, and the committed diff is small. The Research, Validation and Deep review floors still apply, and the 'Full review' label restores the normal review."
  ],
  "routing_version": "issue-phase-v1",
  "order": [
    "Economy",
    "Standard",
    "Deep"
  ],
  "escalation_profile": "Deep",
  "review_floors": {
    "default": "Standard",
    "by_task_kind": {
      "Research": "Deep",
      "Validation": "Deep"
    },
    "by_profile": {
      "Deep": "Deep"
    }
  },
  "phase_overrides": {},
  "review_routing": {
    "light_review": {
      "profile": "Economy",
      "issue_profiles": [
        "Economy",
        "Standard"
      ],
      "task_kinds": [
        "Maintenance",
        "Implementation"
      ],
      "max_changed_files": 8,
      "max_changed_lines": 300,
      "max_repairs": 0,
      "opt_out_labels": [
        "Full review"
      ],
      "gate_labels": [
        "Human gate"
      ]
    }
  }
}
